{
  "project_id": "RS-DEMO-001",
  "name": "بهسازی کریدور کویر–شهرک",
  "status": "construction",
  "contract": {
    "contract_id": "C-DEMO-001",
    "number": "RS-DEMO-001-UNIT-PRICE",
    "type": "unit-price",
    "client": "دستگاه راه فرضی",
    "contractor": "مشارکت زیرساخت فرضی",
    "engineer": "مشاور نظارت فرضی",
    "currency": "IRR",
    "rate_library": "PROJECT-SPECIFIC-2026-REV-A"
  },
  "location": {
    "country": "IR",
    "province": "استان فرضی",
    "from": "شهر الف",
    "to": "شهر ب",
    "start_chainage": "CH 0+000",
    "end_chainage": "CH 18+600",
    "coordinate_reference_system": "PROJECT-CRS-TO-BE-CONFIRMED"
  },
  "dates": {
    "planned_start": "2026-03-01",
    "planned_finish": "2027-02-28"
  },
  "baselines": {
    "schedule": "BL-SCH-001",
    "cost": "BL-CST-001",
    "scope": "BL-SCP-001"
  },
  "reporting": {
    "cut_off_date": "2026-09-15",
    "cadence": "monthly"
  },
  "owners": [
    {
      "role": "project_manager",
      "name": "مدیر پروژهٔ نمونه",
      "record": "PM-001"
    },
    {
      "role": "project_controls",
      "name": "مسئول کنترل پروژهٔ نمونه",
      "record": "CTL-001"
    },
    {
      "role": "hse",
      "name": "مسئول ایمنی و بهداشت نمونه",
      "record": "HSE-001"
    }
  ],
  "external_systems": [
    {
      "system": "schedule",
      "name": "برنامه‌ریز بیرونی",
      "record_id": "SCHED-DEMO-001",
      "snapshot": "2026-09-15"
    },
    {
      "system": "document_cde",
      "name": "محیط کنترل اسناد",
      "record_id": "CDE-DEMO-001",
      "snapshot": "2026-09-15"
    }
  ],
  "classification": "fictional-example"
}
